{
  "proposalStatus": "proposal-not-implemented",
  "schemaVersion": "proposal-v1",
  "sourceDataset": {
    "repository": "https://github.com/HolodoriDB/holodori-db-jpn-diff",
    "commitSha": "e43f062c32ff4e04567235efcd58448cd6b10f35",
    "commitUrl": "https://github.com/HolodoriDB/holodori-db-jpn-diff/tree/e43f062c32ff4e04567235efcd58448cd6b10f35",
    "retrievedAtUtc": "2026-09-29T09:39:12Z",
    "sourceLanguage": "ja-JP",
    "scopeDescription": "Single-card Canonical fixture converted from the existing published-card Sakura Bloom PoC. No runtime/Library/rules integration."
  },
  "cards": [
    {
      "sourceCard": { "table": "Card", "sourceId": "card-00015-5-uniq-0003-00" },
      "identity": {
        "sourceIdFact": {
          "source": { "table": "Card", "sourceId": "card-00015-5-uniq-0003-00" },
          "sourceField": "id",
          "rawValue": "card-00015-5-uniq-0003-00"
        },
        "names": [
          {
            "locale": "ja-JP",
            "textFact": {
              "source": { "table": "LangCard_Jpn", "sourceId": "la-card_name-00015-5-uniq-0003-00" },
              "sourceField": "text",
              "rawValue": "サクラBloom"
            }
          }
        ],
        "memberFacts": [
          {
            "source": { "table": "Card", "sourceId": "card-00015-5-uniq-0003-00" },
            "sourceField": "characterId",
            "rawValue": "chr-00015"
          },
          {
            "source": { "table": "Character", "sourceId": "chr-00015" },
            "sourceField": "nameEng",
            "rawValue": "Sakura Miko",
            "semanticCandidate": {
              "value": "sakura_miko",
              "status": "candidate",
              "basis": "Name-based candidate recorded by the input PoC; not a shared identifier mapping."
            }
          }
        ],
        "memberSourceRefs": [{ "table": "Character", "sourceId": "chr-00015" }]
      },
      "classification": [
        {
          "source": { "table": "Card", "sourceId": "card-00015-5-uniq-0003-00" },
          "sourceField": "rarity",
          "rawValue": "CardRarity_CARD_RARITY_RARITY_5",
          "semanticCandidate": { "value": 5, "status": "candidate", "basis": "Enum suffix and the existing PoC candidate; raw enum remains authoritative evidence." }
        },
        {
          "source": { "table": "Card", "sourceId": "card-00015-5-uniq-0003-00" },
          "sourceField": "attributeType",
          "rawValue": "CardAttributeType_CARD_ATTRIBUTE_TYPE_ATTRIBUTE_3",
          "semanticCandidate": { "value": "happy", "status": "candidate", "basis": "Existing PoC linked ATTRIBUTE_3 to Japanese target/description text identifying ハッピータイプ; no global enum map is asserted." }
        }
      ],
      "progression": {
        "levelRows": [
          {
            "source": { "table": "CardLevel", "sourceId": "group_id=grp-card-level-rarity_5-06;level=80" },
            "facts": [
              { "source": { "table": "CardLevel", "sourceId": "group_id=grp-card-level-rarity_5-06;level=80" }, "sourceField": "groupId", "rawValue": "grp-card-level-rarity_5-06" },
              { "source": { "table": "CardLevel", "sourceId": "group_id=grp-card-level-rarity_5-06;level=80" }, "sourceField": "level", "rawValue": 80 },
              { "source": { "table": "CardLevel", "sourceId": "group_id=grp-card-level-rarity_5-06;level=80" }, "sourceField": "parameterBaseValue", "rawValue": "23512" },
              { "source": { "table": "CardLevel", "sourceId": "group_id=grp-card-level-rarity_5-06;level=80" }, "sourceField": "exp", "rawValue": "1122650" },
              { "source": { "table": "CardLevel", "sourceId": "group_id=grp-card-level-rarity_5-06;level=80" }, "sourceField": "liveDeckPowerPermyriadUp", "rawValue": "8" }
            ]
          }
        ],
        "trainingStages": [
          {
            "source": { "table": "CardLevelLimit", "sourceId": "group_id=rarity_5-attribute_3;limit_break_count=4" },
            "trainingCountFact": { "source": { "table": "CardLevelLimit", "sourceId": "group_id=rarity_5-attribute_3;limit_break_count=4" }, "sourceField": "limit_break_count", "rawValue": 4, "annotations": ["Field is from the source row wrapper, not the nested data object."] },
            "levelLimitFact": { "source": { "table": "CardLevelLimit", "sourceId": "group_id=rarity_5-attribute_3;limit_break_count=4" }, "sourceField": "levelLimit", "rawValue": 80 },
            "facts": [
              { "source": { "table": "CardLevelLimit", "sourceId": "group_id=rarity_5-attribute_3;limit_break_count=4" }, "sourceField": "groupId", "rawValue": "rarity_5-attribute_3" },
              { "source": { "table": "CardLevelLimit", "sourceId": "group_id=rarity_5-attribute_3;limit_break_count=4" }, "sourceField": "limitBreakCount", "rawValue": 4 },
              { "source": { "table": "CardLevelLimit", "sourceId": "group_id=rarity_5-attribute_3;limit_break_count=4" }, "sourceField": "consumptions", "rawValue": [
                { "resourceType": "ResourceType_RESOURCE_TYPE_ITEM", "resourceId": "item-card_limit_break-attribute_3-2", "quantity": "1200" },
                { "resourceType": "ResourceType_RESOURCE_TYPE_ITEM", "resourceId": "item-card_limit_break-cmn-sr", "quantity": "3" },
                { "resourceType": "ResourceType_RESOURCE_TYPE_ITEM", "resourceId": "item-gold", "quantity": "750000" }
              ] }
            ]
          }
        ],
        "bloomSteps": [
          {
            "source": { "table": "CardPotential", "sourceId": "effect_type=1;group_id=card_potential_grp-rarity_5;upgrade_count=1" },
            "bloomStepFact": { "source": { "table": "CardPotential", "sourceId": "effect_type=1;group_id=card_potential_grp-rarity_5;upgrade_count=1" }, "sourceField": "upgradeCount", "rawValue": 1 },
            "effectTypeFact": { "source": { "table": "CardPotential", "sourceId": "effect_type=1;group_id=card_potential_grp-rarity_5;upgrade_count=1" }, "sourceField": "effectType", "rawValue": "CardPotentialEffectType_CARD_POTENTIAL_EFFECT_TYPE_ACTIVE_SKILL_LEVEL_UP" },
            "valueFact": { "source": { "table": "CardPotential", "sourceId": "effect_type=1;group_id=card_potential_grp-rarity_5;upgrade_count=1" }, "sourceField": "value", "rawValue": "2" },
            "facts": [{ "source": { "table": "CardPotential", "sourceId": "effect_type=1;group_id=card_potential_grp-rarity_5;upgrade_count=1" }, "sourceField": "groupId", "rawValue": "card_potential_grp-rarity_5" }]
          },
          {
            "source": { "table": "CardPotential", "sourceId": "effect_type=4;group_id=card_potential_grp-rarity_5;upgrade_count=2" },
            "bloomStepFact": { "source": { "table": "CardPotential", "sourceId": "effect_type=4;group_id=card_potential_grp-rarity_5;upgrade_count=2" }, "sourceField": "upgradeCount", "rawValue": 2 },
            "effectTypeFact": { "source": { "table": "CardPotential", "sourceId": "effect_type=4;group_id=card_potential_grp-rarity_5;upgrade_count=2" }, "sourceField": "effectType", "rawValue": "CardPotentialEffectType_CARD_POTENTIAL_EFFECT_TYPE_ALL_PARAMETER_UP_PERMIL_UP" },
            "valueFact": { "source": { "table": "CardPotential", "sourceId": "effect_type=4;group_id=card_potential_grp-rarity_5;upgrade_count=2" }, "sourceField": "value", "rawValue": "100" },
            "facts": [{ "source": { "table": "CardPotential", "sourceId": "effect_type=4;group_id=card_potential_grp-rarity_5;upgrade_count=2" }, "sourceField": "groupId", "rawValue": "card_potential_grp-rarity_5" }]
          },
          {
            "source": { "table": "CardPotential", "sourceId": "effect_type=3;group_id=card_potential_grp-rarity_5;upgrade_count=3" },
            "bloomStepFact": { "source": { "table": "CardPotential", "sourceId": "effect_type=3;group_id=card_potential_grp-rarity_5;upgrade_count=3" }, "sourceField": "upgradeCount", "rawValue": 3 },
            "effectTypeFact": { "source": { "table": "CardPotential", "sourceId": "effect_type=3;group_id=card_potential_grp-rarity_5;upgrade_count=3" }, "sourceField": "effectType", "rawValue": "CardPotentialEffectType_CARD_POTENTIAL_EFFECT_TYPE_SPECIAL_SKILL_LEVEL_UP" },
            "valueFact": { "source": { "table": "CardPotential", "sourceId": "effect_type=3;group_id=card_potential_grp-rarity_5;upgrade_count=3" }, "sourceField": "value", "rawValue": "2" },
            "facts": [{ "source": { "table": "CardPotential", "sourceId": "effect_type=3;group_id=card_potential_grp-rarity_5;upgrade_count=3" }, "sourceField": "groupId", "rawValue": "card_potential_grp-rarity_5" }]
          },
          {
            "source": { "table": "CardPotential", "sourceId": "effect_type=2;group_id=card_potential_grp-rarity_5;upgrade_count=4" },
            "bloomStepFact": { "source": { "table": "CardPotential", "sourceId": "effect_type=2;group_id=card_potential_grp-rarity_5;upgrade_count=4" }, "sourceField": "upgradeCount", "rawValue": 4 },
            "effectTypeFact": { "source": { "table": "CardPotential", "sourceId": "effect_type=2;group_id=card_potential_grp-rarity_5;upgrade_count=4" }, "sourceField": "effectType", "rawValue": "CardPotentialEffectType_CARD_POTENTIAL_EFFECT_TYPE_PASSIVE_SKILL_LEVEL_UP" },
            "valueFact": { "source": { "table": "CardPotential", "sourceId": "effect_type=2;group_id=card_potential_grp-rarity_5;upgrade_count=4" }, "sourceField": "value", "rawValue": "2" },
            "facts": [{ "source": { "table": "CardPotential", "sourceId": "effect_type=2;group_id=card_potential_grp-rarity_5;upgrade_count=4" }, "sourceField": "groupId", "rawValue": "card_potential_grp-rarity_5" }]
          },
          {
            "source": { "table": "CardPotential", "sourceId": "effect_type=5;group_id=card_potential_grp-rarity_5;upgrade_count=5" },
            "bloomStepFact": { "source": { "table": "CardPotential", "sourceId": "effect_type=5;group_id=card_potential_grp-rarity_5;upgrade_count=5" }, "sourceField": "upgradeCount", "rawValue": 5 },